{
  "$schema": "https://json-schema.org/draft/2020-12/schema",
  "$id": "https://cornermex.example/schemas/staging-readiness-change-request-v1.json",
  "title": "CornerMex Staging Readiness Change Request",
  "description": "Declarative, non-executable record of a staging-only environment variable value correction. It records proposal and externally executed outcomes, but has no deployment or variable-write capability of its own and can never target production.",
  "type": "object",
  "additionalProperties": false,
  "required": [
    "schemaVersion",
    "requestId",
    "founderDecisionId",
    "exactMainSha",
    "targetEnvironment",
    "targetService",
    "variableNames",
    "proposedContractValues",
    "valuesRedacted",
    "preChangeDeploymentId",
    "preChangeSourceSha",
    "preChangeHealth",
    "preChangeReadiness",
    "expectedRedeployBehavior",
    "validationPlan",
    "rollbackPlan",
    "createdAt",
    "expiresAt",
    "maximumEvidenceAgeSeconds",
    "authorizationStatus",
    "executionStatus"
  ],
  "properties": {
    "schemaVersion": { "const": "cornermex-staging-readiness-change-request-v1" },
    "requestId": { "type": "string", "pattern": "^SRC-[0-9]{4}-[0-9]{2}-[0-9]{2}-[A-Za-z0-9-]+$" },
    "founderDecisionId": { "type": "string", "pattern": "^FD-CM-[A-Z0-9.-]+$" },
    "exactMainSha": { "type": "string", "pattern": "^[0-9a-f]{40}$" },
    "targetEnvironment": { "const": "staging" },
    "targetService": { "type": "string", "minLength": 1 },
    "variableNames": {
      "type": "array",
      "minItems": 1,
      "maxItems": 1,
      "uniqueItems": true,
      "items": { "type": "string", "minLength": 1 }
    },
    "proposedContractValues": {
      "type": "object",
      "description": "Maps each variable name to a textual reference to its allowed-value contract (e.g. a source file + field), never to the literal value itself.",
      "minProperties": 1,
      "additionalProperties": { "type": "string", "minLength": 1 }
    },
    "valuesRedacted": { "const": true },
    "preChangeDeploymentId": { "type": "string", "minLength": 1 },
    "preChangeSourceSha": { "type": "string", "pattern": "^[0-9a-f]{40}$" },
    "preChangeHealth": { "enum": ["ok", "degraded", "unknown"] },
    "preChangeReadiness": { "enum": ["ready", "degraded", "unknown"] },
    "expectedRedeployBehavior": {
      "enum": ["restart_required", "rebuild_required", "none_expected", "unknown"]
    },
    "validationPlan": { "type": "string", "minLength": 1 },
    "rollbackPlan": { "type": "string", "minLength": 1 },
    "createdAt": {
      "type": "string",
      "pattern": "^\\d{4}-\\d{2}-\\d{2}T\\d{2}:\\d{2}:\\d{2}Z$"
    },
    "expiresAt": {
      "type": "string",
      "pattern": "^\\d{4}-\\d{2}-\\d{2}T\\d{2}:\\d{2}:\\d{2}Z$"
    },
    "maximumEvidenceAgeSeconds": { "type": "integer", "minimum": 1, "maximum": 604800 },
    "authorizationStatus": {
      "enum": [
        "draft",
        "pending_founder_decision",
        "blocked_contract",
        "blocked_evidence",
        "approved_not_executed",
        "approved_executed",
        "expired",
        "cancelled"
      ]
    },
    "executionStatus": {
      "description": "Records the outcome of an externally executed, Founder-authorized staging change. Repository tooling remains validation-only and never performs the write.",
      "enum": ["not_executed", "executed_verified", "executed_degraded", "rolled_back"]
    },
    "executionEvidenceFile": {
      "const": "docs/program/STAGING_READINESS_EXECUTION_EVIDENCE.json"
    }
  },
  "allOf": [
    {
      "if": {
        "properties": {
          "executionStatus": { "enum": ["executed_verified", "executed_degraded", "rolled_back"] }
        },
        "required": ["executionStatus"]
      },
      "then": {
        "required": ["executionEvidenceFile"],
        "properties": { "authorizationStatus": { "const": "approved_executed" } }
      }
    }
  ]
}
